{"$schema":"https://json-schema.org/draft/2020-12/schema","type":"object","required":["case_id","claim_layer","family","provider_contract","subject_adapter","stimulus","expected"],"properties":{"case_id":{"type":"string","minLength":1},"claim_layer":{"type":"string","minLength":1},"family":{"const":"positive"},"provider_contract":{"type":"string","minLength":1},"subject_adapter":{"type":"string","minLength":1},"stimulus":{"const":{"operation":"verify-knowledge-non-interference","public_observation":"visible-output","secret_variants":["secret-a","secret-b"]}},"expected":{"const":{"public_outputs_equal":true,"secret_observations_absent":true}}},"additionalProperties":false}
