{"case_id":"knowledge-non-interference-positive","claim_layer":"knowledge-non-interference","family":"positive","provider_contract":"pigloros.fixture.knowledge-non-interference@1.0.0","subject_adapter":"exported-artifact","stimulus":{"operation":"verify-knowledge-non-interference","public_observation":"visible-output","secret_variants":["secret-a","secret-b"]},"expected":{"public_outputs_equal":true,"secret_observations_absent":true}}
